{
  "$schema": "https://json-schema.org/draft/2020-12/schema",
  "$id": "prior-art-sweep-schema.json",
  "title": "Prior Art Sweep Schema",
  "description": "Schema for .claude/metadata/prior-art-sweep.json — configuration for the --prior-art sweep run by /enhancement and /proposal before an artifact body is composed. Framework-owned and hub-shared: this file is read-only in user projects, so it carries no project-settable values. The reviewSweep toggle lives in framework-config.json.",
  "type": "object",
  "required": [
    "searchSurfaces",
    "excludes",
    "termDerivation",
    "dispositions",
    "bodyFormat",
    "questions"
  ],
  "properties": {
    "$schema": {
      "type": "string"
    },
    "version": {
      "type": "integer",
      "description": "Schema revision of this data file",
      "minimum": 1
    },
    "searchSurfaces": {
      "type": "object",
      "description": "Surfaces the sweep searches. Resolved against the consuming project at sweep time — never assumed to exist. A configured surface absent from disk is skipped, not fatal. Zero surfaces resolving is a FAILED sweep (PARTIAL), not an empty one.",
      "required": [
        "projectRoots",
        "resolution"
      ],
      "properties": {
        "projectRoots": {
          "type": "array",
          "description": "Candidate source roots, in priority order. Generic across project shapes because this file is read verbatim from the hub by projects with no framework layout. An entry is either a literal directory name (`src`) or a glob pattern whose FIRST path segment contains a wildcard (`*/src`, `pkg-*/docs`). Patterns exist so multi-root and monorepo layouts, whose code sits one level down, resolve a surface at all instead of PARTIAL-ing every sweep (#2555). Depth is bounded to two segments with the wildcard confined to the first: `*/src` is expanded, `*/*/src` and `src/*` are not, and an out-of-bound pattern is reported in `skipped` rather than silently ignored. Literal entries resolve exactly as they always have.",
          "items": {
            "type": "string",
            "minLength": 1,
            "description": "A literal directory name, or a single-level glob (wildcard in the first of exactly two segments)."
          },
          "minItems": 1
        },
        "issueHistory": {
          "type": "object",
          "description": "Issue-history search configuration",
          "properties": {
            "enabled": {
              "type": "boolean"
            },
            "includeClosed": {
              "type": "boolean"
            },
            "command": {
              "type": "string"
            },
            "excludedSections": {
              "type": "object",
              "description": "Sections removed from a candidate issue body before it is matched as evidence (#2874). The corpus is self-contaminating: every sweep writes a Prior Art section and log-changed-files.js a Files Changed section, so without this each sweep degrades the precision of the next. Applied as a post-filter because gh issue list --search cannot exclude a section server-side. Evidence matching only: it never removes a section a command reads as input.",
              "required": [
                "sections",
                "helper",
                "appliesTo",
                "scope"
              ],
              "properties": {
                "sections": {
                  "type": "array",
                  "minItems": 1,
                  "uniqueItems": true,
                  "items": {
                    "type": "string",
                    "minLength": 1
                  },
                  "description": "Every bodyFormat.recognizedForms entry plus ### Files Changed. Pinned to recognizedForms and to the helper's EXCLUDED_SECTION_FORMS by tests/metadata/prior-art-sweep.test.js."
                },
                "helper": {
                  "type": "string",
                  "description": "The deterministic function that applies this declaration."
                },
                "appliesTo": {
                  "type": "array",
                  "minItems": 1,
                  "uniqueItems": true,
                  "items": {
                    "type": "string",
                    "enum": [
                      "issueHistory",
                      "companionRepos"
                    ]
                  },
                  "description": "Issue-search surfaces only. A source tree is never post-filtered."
                },
                "scope": {
                  "type": "string"
                }
              },
              "additionalProperties": false
            },
            "truncation": {
              "type": "string",
              "description": "How a search that returned exactly its --limit is reported (#2874): possibly truncated, never complete."
            }
          },
          "additionalProperties": false
        },
        "retrieval": {
          "type": "object",
          "description": "How matching content is retrieved from a resolved surface (#2874). Count-first: a match count and file list per term before any line is read, then line content only within a declared budget. Measured cost is inversely correlated with value (a common term returned 548 lines while a novel one returned zero), so an unbounded sweep bills most exactly where prior art exists.",
          "required": [
            "strategy",
            "countFirst",
            "lineBudget",
            "overBudget"
          ],
          "properties": {
            "strategy": {
              "const": "count-first"
            },
            "countFirst": {
              "type": "string"
            },
            "lineBudget": {
              "type": "object",
              "required": [
                "perTerm",
                "perFile"
              ],
              "properties": {
                "perTerm": {
                  "type": "integer",
                  "minimum": 1,
                  "description": "Maximum matching lines read for one term across all surfaces."
                },
                "perFile": {
                  "type": "integer",
                  "minimum": 1,
                  "description": "Maximum matching lines read from any one file for one term."
                }
              },
              "additionalProperties": false
            },
            "overBudget": {
              "type": "string"
            },
            "_note": {
              "type": "string",
              "description": "Basis for the initial budget values: the measurement or reasoning they come from."
            }
          },
          "additionalProperties": false
        },
        "companionRepos": {
          "type": "object",
          "description": "Cross-repo issue-history search over charter-registered companion repositories (#2665). Carries no repository list of its own: the list is read from CHARTER.md through companion-projects.js, so this file cannot become a second registry that drifts from the charter.",
          "properties": {
            "enabled": {
              "type": "boolean"
            },
            "includeClosed": {
              "type": "boolean"
            },
            "source": {
              "type": "string",
              "description": "Where the companion list is read from. Prose pointer, not a list."
            },
            "capabilityField": {
              "type": "string",
              "description": "Entity field gating inclusion — searchable, not mere registration."
            },
            "command": {
              "type": "string",
              "description": "Per-companion invocation; must carry --repo, since the unscoped issueHistory command can never see a companion repo."
            },
            "unreachable": {
              "type": "string",
              "enum": [
                "skip"
              ],
              "description": "An unreachable companion is a skipped surface, never a clean no-result: zeroResolved then degrades the report to partial."
            },
            "directionTreatment": {
              "type": "object",
              "description": "How a companion hit is treated, by the companion's declared Direction (#3422). Keys mirror companion-projects.js DIRECTIONS.",
              "required": [
                "upstream",
                "downstream",
                "bidirectional"
              ],
              "properties": {
                "_note": {
                  "type": "string"
                },
                "upstream": {
                  "type": "object",
                  "required": [
                    "treatment",
                    "question",
                    "description"
                  ],
                  "properties": {
                    "treatment": {
                      "type": "string",
                      "enum": [
                        "evidence"
                      ]
                    },
                    "question": {
                      "type": "string",
                      "description": "id of the questions[] entry that weighs the hit"
                    },
                    "description": {
                      "type": "string"
                    }
                  },
                  "additionalProperties": false
                },
                "downstream": {
                  "type": "object",
                  "required": [
                    "treatment",
                    "description"
                  ],
                  "properties": {
                    "treatment": {
                      "type": "string",
                      "enum": [
                        "impact"
                      ]
                    },
                    "description": {
                      "type": "string"
                    }
                  },
                  "additionalProperties": false
                },
                "bidirectional": {
                  "type": "object",
                  "required": [
                    "treatment",
                    "question",
                    "description"
                  ],
                  "properties": {
                    "treatment": {
                      "type": "string",
                      "enum": [
                        "both"
                      ]
                    },
                    "question": {
                      "type": "string",
                      "description": "id of the questions[] entry that weighs the hit"
                    },
                    "description": {
                      "type": "string"
                    }
                  },
                  "additionalProperties": false
                }
              },
              "additionalProperties": false
            }
          },
          "additionalProperties": false
        },
        "resolution": {
          "type": "object",
          "required": [
            "missingSurface",
            "zeroResolved"
          ],
          "properties": {
            "missingSurface": {
              "description": "What to do when a configured surface is absent from disk",
              "const": "skip"
            },
            "zeroResolved": {
              "description": "What to do when NO configured surface resolves. Must be partial — a sweep that searched nothing is a failed sweep, not a clean one.",
              "const": "partial"
            }
          },
          "additionalProperties": false
        }
      },
      "additionalProperties": false
    },
    "excludes": {
      "type": "array",
      "description": "Generated or historical trees that duplicate source hits. Without these, a sweep returns roughly three hits per real feature and authors learn to skim it.",
      "items": {
        "type": "string"
      },
      "minItems": 1,
      "uniqueItems": true
    },
    "termDerivation": {
      "type": "object",
      "description": "How candidate search terms are derived. Derives from the files a change would touch, not only from feature nouns — prior work frequently shares no vocabulary with the request.",
      "required": [
        "stopwords",
        "featureNouns",
        "targetFiles"
      ],
      "properties": {
        "stopwords": {
          "type": "array",
          "items": {
            "type": "string"
          },
          "uniqueItems": true
        },
        "featureNouns": {
          "type": "object",
          "required": [
            "guidance"
          ],
          "properties": {
            "guidance": {
              "type": "string"
            },
            "synonymExpansion": {
              "type": "boolean"
            }
          },
          "additionalProperties": false
        },
        "targetFiles": {
          "type": "object",
          "description": "Derive terms from what a change would modify. This is the axis that finds prior work sharing no vocabulary with the request.",
          "required": [
            "guidance"
          ],
          "properties": {
            "guidance": {
              "type": "string"
            },
            "rationale": {
              "type": "string"
            }
          },
          "additionalProperties": false
        }
      },
      "additionalProperties": false
    },
    "dispositions": {
      "type": "object",
      "description": "Evidence signals mapping sweep findings to one of four verdicts. alreadyShipped, warranted and noneFound answer whether a request is already done; obsolete (#2825) answers whether what a qa-required issue verifies still exists, and is consumed by /qa Step 1 only.",
      "required": [
        "alreadyShipped",
        "warranted",
        "noneFound"
      ],
      "properties": {
        "alreadyShipped": {
          "$ref": "#/$defs/disposition"
        },
        "warranted": {
          "$ref": "#/$defs/disposition"
        },
        "noneFound": {
          "$ref": "#/$defs/disposition"
        },
        "obsolete": {
          "$ref": "#/$defs/disposition"
        }
      },
      "additionalProperties": false
    },
    "bodyFormat": {
      "type": "object",
      "description": "Exact strings emitted into the artifact. Fixed here rather than restated per spec so a downstream consumer can classify a marker without parsing prose. Presence alone is NOT sufficient: a marker line may record that no sweep ran, so a consumer must match the line against the completed-sweep shapes declared here (#2542).",
      "required": [
        "heading",
        "foundFormat",
        "noneFoundFormat",
        "foundEntryFormat",
        "partialFormat"
      ],
      "properties": {
        "heading": {
          "type": "string",
          "description": "Literal heading a consumer tests for"
        },
        "foundFormat": {
          "type": "string",
          "description": "Completed sweep that found prior art, summarized on the heading line. Its entries follow as a foundEntryFormat table. Added in #2542: two swept issues already used this shape and the config did not describe it, so a consumer allowlist derived from bodyFormat classified real completed sweeps as unswept."
        },
        "noneFoundFormat": {
          "type": "string"
        },
        "foundEntryFormat": {
          "type": "string"
        },
        "partialFormat": {
          "type": "string",
          "description": "Incomplete sweep. Distinguishable from noneFoundFormat without parsing prose, and treated by consumers as equivalent to an absent marker."
        },
        "_recognizedFormsNote": {
          "type": "string"
        },
        "recognizedForms": {
          "type": "array",
          "minItems": 1,
          "items": {
            "type": "string"
          },
          "description": "Marker forms the DETECTOR accepts, as opposed to the forms the commands emit (#2700). Documentation for readers of this file, who would otherwise read heading as the sole accepted form — the misreading that produced #2700. Pinned against the implementation by tests/scripts/shared/lib/prior-art-marker.test.js, so it cannot drift from classifyMarker."
        },
        "impactEntryFormat": {
          "type": "string",
          "description": "Row for a downstream companion hit (#3422): who must react when the work lands. Not a prior-art entry; never counted toward found."
        }
      },
      "additionalProperties": false
    },
    "questions": {
      "type": "array",
      "description": "Generative prompts the sweep applies",
      "minItems": 1,
      "items": {
        "type": "object",
        "required": [
          "question",
          "guidance",
          "actionIfFound"
        ],
        "properties": {
          "id": {
            "type": "string"
          },
          "question": {
            "type": "string"
          },
          "guidance": {
            "type": "string"
          },
          "actionIfFound": {
            "type": "string"
          }
        },
        "additionalProperties": false
      }
    }
  },
  "additionalProperties": false,
  "$defs": {
    "disposition": {
      "type": "object",
      "required": [
        "verdict",
        "signals",
        "action"
      ],
      "properties": {
        "verdict": {
          "type": "string"
        },
        "signals": {
          "type": "array",
          "items": {
            "type": "string"
          },
          "minItems": 1
        },
        "action": {
          "type": "string"
        },
        "_note": {
          "type": "string",
          "description": "Optional authoring note explaining why the disposition exists; never consumed by a sweep"
        }
      },
      "additionalProperties": false
    }
  }
}
